Place_Id,Place_Name,Description,Category,City,Rating,Coordinate,Lat,Long,Price,Image
63,Blue Lagoon Jogja,"Blue Lagoon adalah salah satu wisata air Jogja yang sudah sangat terkenal dan banyak dikunjungi oleh wisatawan dari berbagai daerah penjuru. Banyak yang menganggap bahwa Blue Lagoon sebagai surga wisata Jogja tersembunyi. Meskipun keindahan yang ditawarkan oleh tempat ini sangat mahal, namun untuk bisa menikmatinya kamu tidak perlu merogoh kocek dalam2. Karena budget untuk masuk ke area wisata ini tidak semahal yang ada di Islandia.",Taman Hiburan,Yogyakarta,4.3,"{'lat': -7.7044358, 'lng': 110.45026}",-77.044.358,11.045.026,10000,https://1.bp.blogspot.com/-339vMAcd9c8/YDd3qynV79I/AAAAAAAADNg/JTViCSLRPmwSM-nT--HhOXr4fHWME6w7QCLcBGAsYHQ/w1200-h630-p-k-no-nu/Blue%2BLagoon%2BJogja.jpeg
64,Gumuk Pasir Parangkusumo,"Gumuk Pasir Parangkusumo (bahasa Jawa: ꦒꦸꦩꦸꦏ꧀​ꦥꦱꦶꦂ​ꦥꦫꦁ​ꦏꦸꦱꦸꦩ, translit. Gumuk Pasir Parangkusuma) adalah objek wisata di Kabupaten Bantul, Yogyakarta, letaknya di sebelah barat Pantai Parangtritis, yaitu di Desa Parangtritis, Kecamatan Kretek, Kabupaten Bantul, Daerah Istimewa Yogyakarta. Gumuk Pasir ini memiliki sejumlah keistimewaan terkait dengan jumlahnya hanya terbatas di dunia.\nNama ""Gumuk"" berasal dari bahasa Jawa yang artinya gundukan-gundukan pasir yang terhampar luas. Gumuk Pasir Yogyakarta terbentuk dari material Gunung Merapi yang kemudian mengalami transportasi melalui Sungai Opak dan Sungai Progo yang kemudian terbawa ombak dan mengendap di pantai. Material yang mengendap kemudian mengering dan terbawa angin lalu terbang kedaratan sehingga mengalami proses deposisi menjadi Gumuk Pasir.",Taman Hiburan,Yogyakarta,4.5,"{'lat': -8.0173266, 'lng': 110.3180791}",-80.173.266,1.103.180.791,0,https://ksmtour.com/media/images/articles12/gumuk-pasir-parangkusumo-yogyakarta.jpg
65,Bukit Lintang Sewu,"Bukit Lintang Sewu ini berasal ketika pada saat malam hari di bukit ini terlihat ribuan bintang – bintang yang membentang luas di angkasa. Dalam bahasa Jawa Bukit Seribu Bintang adalah Bukit Lintang Sewu (lintang: bintang, sewu: seribu). Pemandangan alam yang tidak kalah mempesona membuat Bukit Langit Sewu ini menjadi tempat favorit bagi pecinta alam. Pada saat menuju bukit, pengunjung akan disuguhkan dengan pepohonan pinus, tetapi saat sampai pengunjung akan disuguhkan panorama hutan Kayu Putih yang menjadi keunikan tempat wisata ini. Diatas pohon Kayu Putih ini juga terdapat Burung Alap-alap yang melintas diatas pohonnya. Selain itu pengunjung juga akan dimanjakan dengan deretan pegunungan seperti Gunung merbabu, Gunung Sumbing, Menoreh, dan Gunung Merapi.",Taman Hiburan,Yogyakarta,4.5,"{'lat': -7.915799699999999, 'lng': 110.4366436}",-79.157.997,1.104.366.436,2000,https://raskita.com/wp-content/uploads/2019/09/Bukit-Lintang-Sewu.jpg
66,Studio Alam Gamplong,"Studio Gamplong atau Studio Alam Gamplong adalah sebuah tempat wisata yang terletak di Desa Gamplong, Kecamatan Moyudan, Kabupaten Sleman. Tempat tersebut awalnya adalah tempat pengambilan gambar film Sultan Agung: Tahta, Perjuangan, Cinta dan Bumi Manusia karya Hanung Bramantyo. Tempat tersebut didirikan di atas lahan seluas 2,5 hektar. Tempat tersebut diresmikan oleh Presiden Joko Widodo pada 15 Juli 2018.",Taman Hiburan,Yogyakarta,4.4,"{'lat': -7.805793599999998, 'lng': 110.2367304}",-78.057.936,1.102.367.304,10000,https://www.goodnewsfromindonesia.id/uploads/post/large-pict-studio-gamplong-mini-hollywood-ala-indonesia-a624d39bd685f00217e3e795ab105c36.jpg
67,Watu Lumbung,"Letak Kampung Edukasi Watu Lumbung yang berada di area perbukitan dipenuhi rerimbunan pohon jati, membuat pemandadangan dari tempat ini sangat indah sekali. Watu Lumbung dikonsep oleh M Boy Rifai sebagai tempat yang mengajarkan nilai-nilai edukasi, di mana Boy Rifai telah berhasil menyulap lahan tandus yang dulunya dibiarkan saja, kini menjadi tempat eksotis untuk menikmati malam maupun melihat sunset dan sunrise. Untuk menjaga keasrian di daerah sekitar tempat wisata pengelolah sengaja membangun area ini sebagai kawasan wisata yang selaras dengan alam.",Cagar Alam,Yogyakarta,4.3,"{'lat': -7.992437900000001, 'lng': 110.317778}",-79.924.379,110.317.778,5000,https://www.tuguwisata.com/wp-content/uploads/2017/11/gasjogja_28_11_2017_15_31_52_811-1024x1024.jpg
68,Air Terjun Kedung Pedut,"Air Terjun Kedung Pedut atau biasa disebut Curug Kedung Pedut berasal dari istilah bahasa Jawa. Curug yang berarti air terjun, kedung berarti kubangan atau kolam, dan pedut berarti kabut. Air Terjun Kedung Pedut merupakan salah satu wisata alam yang di Kulonprogo yang dikenal karena keindahan warna airnya.",Cagar Alam,Yogyakarta,4.5,"{'lat': -7.769987499999998, 'lng': 110.1210707}",-77.699.875,1.101.210.707,20000,https://upload.wikimedia.org/wikipedia/commons/e/e1/Kedungpedut.jpg
69,Puncak Kebun Buah Mangunan,"Berlibur di pegunungan memang menyenangkan. Dapat menikmati sejuknya udara serta pemandangan indah dari atas perbukitan. Wisata seperti ini dapat dinikmati di Bantul, tepatnya di Kebun Buah Mangunan. Beruntungnya Jogja dikaruniai bentang alam yang begitu indah. Ada pantai, gunung, bukit, serta kota dan budaya yang sangat menarik. Kebun Buah Mangunan hadir sebagai objek wisata yang begitu menarik minat wisatawan. Apalagi di pagi hari, pemandangannya tak ubahnya seperti negeri di atas awan.",Taman Hiburan,Yogyakarta,4.6,"{'lat': -7.941371800000001, 'lng': 110.4247345}",-79.413.718,1.104.247.345,5000,https://www.pakbob.id/wp-content/uploads/2021/08/5-Foto-Suasana-Puncak-Kebun-Buah-Mangunan-Selama-1-Hari-Yang-Instagrammable-Pakbob.id_.jpg
70,Desa Wisata Gamplong,"Desa Wisata Gamplong adalah desa wisata kerajinan tenun yang berada di Padukuhan Gamplong Desa Sumber Rahayu Kecamatan Moyudan Kabupaten Sleman, Yogyakarta. Desa wisata yang terletak di sebelah barat Kota Yogyakarta ini cukup menarik untuk disinggahi wisatawan terlebih karena masih adanya industri kerajinan tenun tradisional dengan menggunakan Alat Tenun Bukan Mesin (ATBM). Dengan ATBM, masyarakat perajin Gamplong mampu menghasilkan kain tenun sebagai bahan stagen (kain panjang untuk melilit bagian perut wanita). Selain kerajinan tenun, perajin juga mampu memproduksi kerajinan anyaman untuk suvenir.",Taman Hiburan,Yogyakarta,4.4,"{'lat': -7.805523199999997, 'lng': 110.2374676}",-78.055.232,1.102.374.676,10000,https://asset.kompas.com/crops/ptPOoi-0zZrK5veBrUraSQ3gwGw=/82x0:672x393/750x500/data/photo/2019/12/28/5e0724389c570.jpg
71,Kawasan Wisata Sosrowijayan,"Tempat wisata Sosrowijayan memang selama ini dikenal sebagai Wisata Kampung bule, lokasinya sendiri berada di pusat kota Yogyakarta sehingga hampir tiap hari di lokasi ini banyak sekali pengunjungnya yang sangat padat. Bagi Anda yang ingin berkunjung ke sini, harus menggunakan kendaraan karena dari arah stasiun Tugu Anda tinggal berjalan selama 200 meter selanjutnya anda pun akan langsung menemukan daerah Sosrowijayan yang mempunyai tanda yaitu Sebuah Jalan Kecil menuju Barat dengan nama yang sama. Wisata unik sosrowijayan menjadi membagi dua daerah yaitu Sosrowijayan Wetan dan Sosrowijayan Kulon dan menjadi penghubung jalan Jogonegaran dan Jalan Malioboro. Akan tetapi untuk Sosrowijayan Wetan yang saat ini langsung terkenal sampai ke penjuru dunia dan dikenal sebagai Kampung turis kedua di Yogyakarta setelah Prawirotaman. Karena disebut Kampung bule maka disini pun anda akan melihat banyak sekali turis dari mancanegara yang menikmati suasana malam di Yogyakarta. Anda pun bisa melihat dua buah busuk seperti yang ada di daerah Prawirotaman ketika memasuki dan pertama. Di daerah ini banyak sekali buku yang dijual seperti novel berbahasa Inggris, buku kecil berbahasa Indonesia, dan beberapa buku yang berkualitas dan pastinya akan memberikan pendidikan bagi para pembacanya.",Pusat Perbelanjaan,Yogyakarta,4,"{'lat': -7.7916235, 'lng': 110.361956}",-77.916.235,110.361.956,0,https://img.okezone.com/content/2018/10/12/406/1963126/beragam-hal-unik-yang-ditawarkan-kampung-sosrowijayan-di-yogyakarta-w63GfGCCfY.jpg
72,Grojogan Watu Purbo Bangunrejo,"Objek wisata itu tak adalah Grojogan Watu Purbo yang berada di Bangunrejo, Merdikorejo, Kecamatan Tempel. Objek wisata itu sekitar setahun terakhir cukup populer di kalangan wisatawan karena memiliki pemandangan eksotis berupa air terjun yang memiliki enam tingkatan. Wisatawan yang datang rata-rata menjadikan air terjun itu sebagai latar untuk swafoto karena pemandangannya yang dinilai instagramable. Grojokan Watu Purbo ini tepatnya berlokasi di aliran Kali Krisak, yang merupakan jalur dari lahar dingin yang mengalir dari Gunung Merapi. Pemandangan kawasan ini eksotis karena dikepung pepohonan asri serta hamparan sawah. Munculnya air terjun atau grojogan ini berasal dari enam dam dengan ketinggian bervariasi tak lebih dari 10 meter.",Taman Hiburan,Yogyakarta,4.5,"{'lat': -7.6340172, 'lng': 110.33837}",-76.340.172,11.033.837,10000,https://asset.kompas.com/crops/wXX1MvMLkTVW1qkcgemVXMX2hT0=/0x0:1000x667/750x500/data/photo/2020/01/26/5e2d5f4c2853a.jpg
73,Wisata Alam Kalibiru,"Kalibiru sebenarnya adalah sebuah nama hutan yang saat ini diolah menjadi sebuah tempat wisata alam. Hutan Kalibiru memiliki ketinggian 450 mdpl dan berupa kawasan perbukitan yang subur. Suhu udara di tempat ini sangat sejuk. Kalibiru dikelola oleh pemerintah dan masyarakat setempat sebagai wisata alam dan edukasi. Ada banyak hal yang bisa didapatkan di sana, termasuk outbond, penginapan, dan beberapa spot untuk mencari foto kekinian. Ada juga jalur trekking yang juga bisa dijadikan lokasi camping.",Cagar Alam,Yogyakarta,4.4,"{'lat': -7.8057305, 'lng': 110.127969}",-78.057.305,110.127.969,20000,https://4.bp.blogspot.com/-oXJlbBO77Pg/VsSsMuqN_1I/AAAAAAAABzs/jpj-62q9oFY/s1600/kalibiru-jogja.jpg
74,Jogja Exotarium,"Di Yogyakarta, tepatnya di Sleman, ada satu tempat wisata edukasi yang patut dikunjungi. Namanya adalah Jogja Exotarium — terdengar unik, kan? Namun sebenarnya, tempat ini merupakan taman hewan berskala kecil. Koleksi hewannya beragam dan bisa diajak berinteraksi secara langsung",Taman Hiburan,Yogyakarta,4.4,"{'lat': -7.7280356, 'lng': 110.3591712}",-77.280.356,1.103.591.712,20000,https://alinea.mmtc.ac.id/wp-content/uploads/2019/06/LRM_EXPORT_86949630254943_20190511_192946881.jpeg
75,Puncak Gunung Api Purba - Nglanggeran,"Gunung Nglanggeran adalah sebuah gunung di Daerah Istimewa Yogyakarta, Indonesia. Gunung ini merupakan suatu gunung api purba yang terbentuk sekitar 0,6-70 juta tahun yang lalu atau yang memiliki umur tersier (Oligo-Miosen). Gunung Nglanggeran memiliki batuan yang sangat khas karena didominasi oleh aglomerat dan breksi gunung api. Gunung ini terletak di Desa Nglanggeran, Kecamatan Patuk, Kabupaten Gunung Kidul yang berada pada deretan Pegunungan Baturagung.",Cagar Alam,Yogyakarta,4.7,"{'lat': -7.841252999999998, 'lng': 110.543056}",-7.841.253,110.543.056,10000,https://asset.kompas.com/crops/FhSsmAIXqsW3aC2SwsopH2Yq054=/0x0:780x520/750x500/data/photo/2019/08/13/5d5276ef2ac7f.jpg
76,Bendung Lepen,"Bendung Lepen sendiri dulunya merupakan saluran irigasi yang tidak sebersih sekarang ini. Sebelumnya, tempat ini merupakan saluran irigasi yang kumuh disertai taman desa yang tak terurus. Namun, kesadaran para pemuda akan kebersihan lingkungan mengubah kali (sungai/lepen) yang semula begitu kotor menjadi tempat wisata yang disenangi banyak orang. Bendung Lepen sekarang menjadi indah dan dipenuhi ikan nila dan gurame. Jika dulunya hanya menjadi taman wisata yang tidak terurus dan kumuh, sekarang ini Bendung Lepen menjadi destinasi wisata yang nyaman dikunjungi bersama keluarga. Bahkan di kala pandemi COVID-19 ini, Bendung Lepen tidak kekurangan peminat. Masih banyak anak-anak yang menikmati senja dengan riang sambil memberi makan ikan di kali. Tentunya ditemani oleh orang tuanya yang juga bisa mencuci mata melihat aliran air yang jernih dengan ikan warna-warni yang berenang di kali. Selain itu, banyak juga anak muda yang duduk-duduk di taman sembari menikmati udara sore yang sejuk ditemani segelas es teh.",Taman Hiburan,Yogyakarta,4.6,"{'lat': -7.831666800000002, 'lng': 110.3945119}",-78.316.668,1.103.945.119,0,https://assets.pikiran-rakyat.com/crop/0x0:0x0/x/photo/2020/08/30/1915729901.jpg
77,Bunker Kaliadem Merapi,"Bunker Kaliadem merupakan objek wisata yang terletak di lereng selatan Gunung Merapi. Destinasi wisata ini banyak menyimpan jejak erupsi gunung tersebut, terutama tahun 2006 dan 2010. Lokasi fenomenal tersebut berada di ketinggian lebih dari 2.000 meter di atas permukaan laut. Berada di Kabupaten Sleman, wisatawan diajak menyaksikan kegagahan Merapi dari jarak lima kilometer. Kawasan ini memadukan sejarah, keindahaan serta keunikan alam gunung merapi dengan fenomena vulkaniknya.",Cagar Alam,Yogyakarta,4.5,"{'lat': -7.582919800000001, 'lng': 110.4476816}",-75.829.198,1.104.476.816,3000,https://ksmtour.com/media/images/articles27/Puncak-Kaliadem-Sleman-Yogyakarta.jpg
78,Ledok Sambi,"Desa wisata Ledok Sambi merupakan desa yang mempunyai nuansa alami asli Jogja, yang berlokasi dekat dengan Gunung Merapi atau berada di Jl. Kaliurang Km. 19,2 Padukuhan Sambi Desa Pakembinangun Kec. Pakem Kabupaten Sleman Daerah Istimewa Yogyakarta. Pemandangan alam yang indah dapat memberikan kesejukan, kesegaran dan ketentraman hati. Sepanjang mata memandang di Desa wisata ini anda akan disuguhkan bentangan luasnya persawahan yang alami dan asri dan juga pepohonan yang hijau nan rindang serta kejernihan air yang dimiliki wilayah Desa Wisata Ledok Sambi. Rumah-rumah Tradisional khas Jogja yang luas dijadikan sebagai tempat bermain sambil menikmati udara sejuk yang menenangkan hati jiwa dan pikiran.",Cagar Alam,Yogyakarta,4.6,"{'lat': -7.647094300000001, 'lng': 110.4280998}",-76.470.943,1.104.280.998,0,https://asset.kompas.com/crops/o_akCZEXKWMiaHumooi0GhYUv78=/0x944:2832x2832/750x500/data/photo/2020/12/16/5fd96d954aa96.jpg
79,Seribu Batu Songgo Langit,"Nama Seribu Batu Songgo Langit memiliki makna tersendiri. Sebelum jadi tempat wisata, di lokasi ini terdapat ratusan bahkan ribuan batu dan pastinya hutan pinus. Songgo langit berarti penyangga langit, hal ini dikarenakan di Seribu Baru Songgo Langit terdapat bukit yang seakan akan merupakan tiang dari langit .Seribu Batu Songgo Langit merupakan tempat wisata di kawasan Dlingo yang menawarkan berbagai macam atraksi wisata, namun kebanyakan adalah spot foto. Spot foto di Seribu Batu hampir semuanya anti mainstream. Anda akan menemui beberapa spot foto dalam empat bagian di tempat wisata ini. Memasuki gerbang Seribu Batu Songgo Langit anda diharuskan untuk menuruni tangga yang terbuat dari kayu untuk mencapai spot pertama. Spot pertama ini menawarkan rumah dongeng seribu kayu. Spot ini berbentuk rumah kecil-kecil yang menyerupai rumah kurcaci dalam dongeng. Terdapat tujuh buah rumah kurcaci yang ditata secara mengerucut sehingga akan menciptakan angle foto yang bagus.",Cagar Alam,Yogyakarta,4.6,"{'lat': -7.931098399999999, 'lng': 110.430919}",-79.310.984,110.430.919,2000,https://asset.kompas.com/crops/7rysl2HT1dGdOKsnkK_0HhUR5HU=/0x0:1200x800/750x500/data/photo/2020/09/05/5f5307faa390d.jpg
80,Goa Jomblang,"Gua Jomblang merupakan gua vertikal yang bertipe collapse doline. Gua ini terbentuk akibat proses geologi amblasnya tanah beserta vegetasi yang ada di atasnya ke dasar bumi yang terjadi ribuan tahun lalu. Runtuhan ini membentuk sinkhole atau sumuran yang dalam bahasa Jawa dikenal dengan istilah luweng. Itulah yang membuat unik karena di dalam gua terdapat luas mulut gua sekitar 50 meter ini sering disebut dengan nama Luweng Jomblang. Gua Jomblang terletak di Kabupaten Gunungkidul, DI Yogyakarta.\nSaat ini Gua Jomblang merupakan tempat konservasi tumbuhan purba dan dikembangkan menjadi tempat wisata minat khusus yang mana dikelola oleh penduduk atau warga setempat. Untuk menuruni gua vertikal ini pihak pengelola sudah menyediakan perlengkapan lengkap sesuai standar keselamatan caving di gua vertikal.\nSinar matahari yang menerobos masuk dari Luweng Grubug setinggi 90 meter membentuk satu tiang cahaya, menyinari flowstone yang indah serta kedalaman gua yang gelap gulita. Air yang menetes dari ketinggian turut mempercantik pemandangan. Tidak salah\njika banyak orang terkagum-kagum datang ke sini ketika menyaksikan lukisan alam yang dikenal dengan istilah ""cahaya surga"".",Cagar Alam,Yogyakarta,4.6,"{'lat': -8.0281562, 'lng': 110.6383307}",-80.281.562,1.106.383.307,500000,https://www.pegipegi.com/travel/wp-content/uploads/2017/10/Jomblang2.jpg
81,Desa Wisata Rumah Domes/Teletubbies,"Kawasan desa teletubbies menjadi perhatian menarik berbagai media, sehingga menjadikan para wisatawan mulai berbondong-bondong datang kesana. Hingga sekarang kawasan ini menjadi objek wisata unik jogja yang menarik dikunjungi. Bagi kawan-kawan datawisata yang sedang berlibur atau berdomisili di Yogyakarta dan sekitar, coba deh rasakan sensasi wisata unik ini, setidaknya bisa dijadikan koleksi foto yang mengusung spot-spot kece instagenic. Mulanya objek wisata Rumah Domes merupakan bentuk bantuan dari NGO, kala itu Yogyakarta terkena musibah bencana alam gempa bumi. Di desa Nglepen setidaknya ada 80 bangunan mengusung desain rumah dome lengkap beserta fasilitas seperti warung makan, toilet umum, area parkir, tempat ibadah, rumah kesehatan dan balai desa yang kerap dimanfaatkan ketika ada hajatan atau acara budaya. Desa wisata Sumberharjo ini memiliki luas kurang lebih 2 hektar serta bangunan dibangun sejak tahun 2006. Selain disebut desa teletubbies, pemukiman disana juga sering disebut New Nglepen.",Taman Hiburan,Yogyakarta,4.1,"{'lat': -7.813608499999999, 'lng': 110.5033442}",-78.136.085,1.105.033.442,5000,https://visitingjogja.jogjaprov.go.id/web/wp-content/uploads/2021/04/26357499_1951388054890307_5223426156086165504_n.jpg
82,Bukit Wisata Pulepayung,"Pule Payung Yogyakarta. Sebuah objek wisata populer yang menyajikan keindahan alam dari ketinggian 500 mdpl. Bukit Wisata Pule Payung Yogyakarta merupakan kawasan wisata yang dipenuhi dengan kreativitas yang tinggi, merubah zona biasa menjadi luar biasa. Daya tarik yang pertama dari Pule Payung Yogyakarta adalah objek wisata yang menyajikan pesona alam pegunungan. Sehingga, orang-orang menyebutnya dengan Bukit Wisata. Ketinggian Pule Payung Yogyakarta sekitar 500 mdpl, serta jalan menuju Pule Payung Yogyakarta dapat ditempuh dengan kendaraan roda dua, maupun roda empat. Pesona keindahan Waduk Sermo dapat terlihat jelas saat berada di Pule Payung. Waduk eksotis yang dikelilingi pegunungan yang masih asri. Dan Pule Payung Yogyakarta adalah bukit yang notabene sebagai destinasi wisata alam, diberikan sentuhan kreativitas, serta memprioritaskan aspek keamanan di setiap spotnya, akhirnya menjadi wisata favorit di Jogja.",Cagar Alam,Yogyakarta,4.5,"{'lat': -7.800110599999999, 'lng': 110.1238954}",-78.001.106,1.101.238.954,10000,https://asset.kompas.com/crops/jkG1QPKbAXNyg3nhN-kGrnuy6No=/0x63:1008x567/780x390/data/photo/2020/09/29/5f732804ceedc.jpg
83,Bentara Budaya Yogyakarta (BBY),"Bentara Budaya Yogyakarta adalah pusat budaya yang terletak di Yogyakarta, Indonesia. Bentara Budaya Yogyakarta dibuka pada 26 September 1982, didanai oleh Kompas Gramedia Group. Bentara Budaya Yogyakarta adalah cabang dari Bentara Budaya Jakarta, sebuah lembaga budaya yang dikelola oleh Kompas Gramedia Group yang juga memiliki beberapa pusat budaya di Jakarta, Surakarta (sebagai Balai Soedjatmoko), dan Bali.",Budaya,Yogyakarta,4.5,"{'lat': -7.7857242, 'lng': 110.3746954}",-77.857.242,1.103.746.954,0,https://pariwisata.jogjakota.go.id/resources/img/article/20190425084333.jpg
84,Goa Rancang Kencono,"Goa Rancang Kencono yang terletak di Padukuhan Menggoran, Desa Bleberan, Kecamatan Playen, Gunungkidul, Yogyakarta, merupakan salah satu goa yang yang dihuni manusia prasejarah hingga modern. Diperkirakan goa yang terletak di kawasan air terjun Sri Getuk ini sudah dihuni sejak 3000 tahun lalu. Dari buku Ragam Warisan Budaya dan Cagar Budaya Gunungkidul yang ditulis oleh Winarsih (Kepala Seksi Kepurbakalaan dan Permuseuman, Bidang Pelestarian Warisan dan Nilai Budaya, Dinas Kebudayaan Gunungkidul), Arkeologi UGM Yogyakarta pada tahun 2001 sudah pernah melakukan penelitian tersebut. Goa Rancang Kencono sudah dihuni manusia sejak 3000 tahun yang lalu dengan bukti temuan tulang manusia.",Cagar Alam,Yogyakarta,4.3,"{'lat': -7.9492612, 'lng': 110.4926511}",-79.492.612,1.104.926.511,5000,https://www.alodiatour.com/wp-content/uploads/2019/01/goa-rancang-kencono.jpg
85,Goa Cerme,"Gua Cerme (bahasa Jawa: ꦒꦸꦮ​ꦕꦺꦂꦩꦺ, translit. Gua Cerme) adalah gua bersejarah dan sekaligus tempat wisata yang terletak di Dusun Srunggo, Desa Selopamioro, Kecamatan Imogiri, Kabupaten Bantul atau sekitar 20 km selatan Kota Yogyakarta. Gua Cerme memiliki panjang 1,5 km yang tembus hingga sendang di wilayah Panggang, yaitu di Dusun Ploso, Desa Giritirto, Kecamatan Purwosari, Kabupaten Gunungkidul.\nDi samping gua Cerme, di sekitarnya terdapat gua lain yang lebih kecil seperti Goa Dalang, Goa Ledek, Goa Badut dan Goa Kaum yang sering digunakan untuk bersemedi. Untuk mencapai gua, terdapat tangga setinggi 759 m. Kata cerme berasal dari kata ceramah yang mengisyaratkan pembicaraan yang dilakukan walisongo. Gua Cerme dulunya digunakan oleh para Walisongo untuk menyebarkan agama Islam di Jawa. Selain itu, Gua Cerme juga digunakan untuk membahas rencana pendirian Masjid Agung Demak. Setiap Senin atau Selasa wage, selalu diadakan upacara syukuran untuk meminta berkah kepada Tuhan.",Cagar Alam,Yogyakarta,4.4,"{'lat': -7.979441299999999, 'lng': 110.3803114}",-79.794.413,1.103.803.114,3000,https://happytour.id/wp-content/uploads/sites/30/2018/07/GoaCerme1.jpg
86,Wisata Kraton Jogja,"Kraton Jogja adalah sebuah komplek kerajaan yang berada tepat berdiri di tengah kota Yogyakarta. Kraton yang didirikan seiring perjanjian giyanti pada tahun 1755 yang memecah Kerajaan Mataram Islam menjadi Kerajaan Ngayogyakarta Surakarta ini menyimpan keindahan arsitektur jawa yang tidak diragukan lagi, dan merupakan salah komplek istana terbaik di tanah jawa. Keindahan Kraton Jogja ini tidak terlepas dari pendirinya, yaitu Sri Sultan Hamengkubuwono I yang merupakan arsitek dari kerajaannya ini. Apabila anda sedang wisata ke Kraton Jogja maka apabila anda dari Jalan Malioboro pertama anda akan disambut oleh Gapura Pangurakan yang berasitrektur jawa kental yang bersebelahan dengan bangunan-bangunan Hindia Belanda. Setelah memasukinya anda akan memasuki Alun-alun Utara yang memiliki area yang cukup luas. Di sekelilingnya terdapat Joglo-joglo tertutup yang disebut Gedhong dan terbuka yang dinamakan Tratag. Di area ini terdapat beberapa pilihan kuliner yang sangat pas anda kunjungi sebelum anda memasuki kompleks Kraton Yogyakarta, sehingga anda tidak merasa kelaparan.",Budaya,Yogyakarta,4.7,"{'lat': -7.806753499999999, 'lng': 110.3636659}",-78.067.535,1.103.636.659,7000,https://travelspromo.com/wp-content/uploads/2019/05/salah-satu-ruang-di-keraton-yogyakarta-Mujiman-Muji.jpg
87,Desa Wisata Kelor,"Desa wisata Kelor merupakan salah satu desa yang ada di kabupaten Sleman yang saat ini sedang dikembangkan menjadi desa wisata. Desa wisata Kelor ini menawarkan suasana pedesaan yang penduduknya bermata pencaharian sebagai petani, peternak, dan budidaya jamur. Banyak tanaman hijau yang membentang luas dengan pemandangan alam yang asri. Desa wisata Kelor ini memiliki masyarakat yang ramah dan memiliki lingkungan desa yang sangat nyaman. Desa Kelor ini juga memiliki sungai, dan air di sungai tersebut masih jernih dan indah.",Taman Hiburan,Yogyakarta,4.4,"{'lat': -7.641025800000001, 'lng': 110.3622794}",-76.410.258,1.103.622.794,0,https://bernasnews.com/wp-content/uploads/2019/12/DUSUN-KELOR-SLEMAN-1-1024x702.jpeg
88,Pantai Patihan,"Pantai ini terletak di daerah Srigading, Sanden dan cukup dekat dengan Pantai Goa Cemara. Tempatnya juga asyik banget buat foto-foto, nggak beda jauh dengan Pandasari.",Bahari,Yogyakarta,4.1,"{'lat': -7.997777999999999, 'lng': 110.2449113}",-7.997.778,1.102.449.113,5000,https://img.inews.co.id/media/822/files/inews_new/2019/05/09/gua_cemara1.jpg
89,Pantai Kukup,"Pantai Kukup adalah salah satu pantai yang memiliki hamparan pasir putih yang terkenal di Kabupaten Gunung Kidul, Yogyakarta. Selain memiliki pemandangan pantai yang cantik, pantai ini juga memberikan keunikan tersendiri. Di pantai ini terdapat pulau Karang yang menjadi daya tarik utama bagi para wisatawan lokal atau mancanegara. Karena di pulau Karang ini para wisatawan dapat menikmati keindahan pantai yang sangat menawan. Pantai cantik ini berada di sebelah timurnya Pantai Baron, kurang lebih berjarak sekitar 1 km. Tepatnya berada di Desa Kemadang, Kecamatan Tanjungsari, Kabupaten Gunung Kidul, Yogyakarta. Pantai Kukup ini masih dalam satu barisan dengan Pantai Baron, Pantai Krakal, Pantai Sundak, Pantai Sepanjang dan pantai-pantai lainnya. Jarak dari Kota Jogja ke pantai ini sekitar 40 km sedangkan jarak dari Kota Wonosari sekitar 25 km.",Bahari,Yogyakarta,4,"{'lat': -8.133876299999999, 'lng': 110.5548349}",-81.338.763,1.105.548.349,10000,https://asset.kompas.com/crops/A5cXbkevWJPpmXQ_198MFFsOE4k=/0x0:1000x667/750x500/data/photo/2020/06/27/5ef7129a3f9e6.jpg
