Place_Id,Place_Name,Description,Category,City,Rating,Coordinate,Lat,Long,Price,Image
112,Museum Gunung Merapi,"Museum Gunung Merapi (bahasa Jawa: ꧋ꦩꦸꦱꦶꦪꦸꦩ꧀​ ꦒꦸꦤꦸꦁ​ ꦩꦼꦫꦥꦶ꧉, translit. Musiyum Gunung Merapi) merupakan museum bersejarah yang terdapat di Yogyakarta tepatnya di Jln. Boyong, Dusun Banteng, Desa Hargobinangun, Kecamatan Pakem, Kabupaten Sleman, Daerah Istimewa Yogyakarta sekitar lima kilometer dari kawasan objek wisata Kaliurang. Museum Gunung Merapi telah diresmikan pada tanggal 1 Oktober 2009 oleh Menteri Energi dan Sumber Daya Mineral (ESDM), Purnomo Yusgiantoro.\nDengan luas bangunan sekitar 4,470 yang berdiri di atas tanah seluas 3,5 hektare, museum yang ke depan juga akan dilengkapi dengan taman, area parkir, dan plasa ini ingin dikenal masyarakat sebagai Museum Gunungapi Merapi dengan semboyan Merapi Jendela Bumi .\nMuseum Gunung Merapi ini dapat dijadikan sebagai sarana pendidikan, penyebarluasan informasi aspek kegunungapian khususnya dan kebencanaan geologi lainnya yang bersifat rekreatif-edukatif untuk masyarakat luas dengan tujuan untuk memberikan wawasan dan pemahaman tentang aspek ilmiah, maupun sosial-budaya dan lain-lain yang berkaitan dengan gunungapi dan sumber kebencanaan geologi lainnya. Museum Gunungapi ini diharapkan dapat menjadi solusi alternatif sebagai sarana yang sangat penting dan potensial sebagai pusat layanan informasi kegunungapian dalam upaya mencerdaskan kehidupan masyarakat, serta sebagai media dalam meningkatkan kesadaran dan kewaspadaan masyarakat tentang manfaat dan ancaman bahaya letusan gunungapi serta bencana geologi lainnya .",Budaya,Yogyakarta,4.4,"{'lat': -7.615927200000001, 'lng': 110.4243329}",-76.159.272,1.104.243.329,10000,https://oyindonesia.id/wp-content/uploads/2020/04/Museum-Gunung-Merapi-Geo-Wisata-di-Kabupaten-Sleman.png
113,Pantai Parangtritis,"Pantai Parangtritis (bahasa Jawa: ꦥꦱꦶꦱꦶꦂ ꦥꦫꦁꦠꦿꦶꦠꦶꦱ꧀, translit. Pasisir Parangtritis) adalah tempat wisata yang terletak di Desa Parangtritis, Kretek, Kabupaten Bantul, Daerah Istimewa Yogyakarta. Jaraknya kurang lebih 27 km dari pusat Kota Yogyakarta. Pantai ini boleh terbilang adalah salah satu destinasi wisata terkenal di Yogyakarta dan paling favorit diantara para wisatawan sejak lama, bahkan Pantai Parangtritis telah menjadi ikon pariwisata di Yogyakarta. Pantai Parangtritis mempunyai nilai simbolis yang merupakan garis yang bersifat magis yang menghubungkan Panggung Krapyak, Keraton Yogyakarta, Tugu Yogyakarta dan Gunung Merapi yang dikenal sebagai Garis Imajiner Yogyakarta.\nPantai yang terletak di sisi timur Pantai Parangkusumo ini terkenal diantara para wisatawan karena memiliki legenda yang melekat dengan Ratu Kidul sebagai penguasa laut selatan dan keindahannya. Pantai ini merupakan pantai yang cukup luas di Yogyakarta, berbeda dengan pantai-pantai di kawasan Yogyakarta lainya seperti Pantai di Gunungkidul yang ukurannya relatif kecil.",Bahari,Yogyakarta,4.5,"{'lat': -8.024607999999999, 'lng': 110.3298045}",-8.024.608,1.103.298.045,10000,https://upload.wikimedia.org/wikipedia/commons/b/b3/Dusk_till_dawn_%28cropped%29.jpg
114,Goa Pindul,"Gua Pindul adalah objek wisata berupa gua yang terletak di Desa Bejiharjo, Kecamatan Karangmojo, Kabupaten Gunungkidul. Gua Pindul dikenal karena cara menyusuri gua yang dilakukan dengan menaiki ban pelampung di atas aliran sungai bawah tanah di dalam gua, kegiatan ini dikenal dengan istilah cave tubing.",Cagar Alam,Yogyakarta,4.5,"{'lat': -7.9339721, 'lng': 110.651966}",-79.339.721,110.651.966,40000,https://dynamic-media-cdn.tripadvisor.com/media/photo-o/16/05/ef/93/sewa-mobil-jogja-paket.jpg?w=1200&h=-1&s=1
115,Candi Ratu Boko,"Situs Ratu Baka atau Candi Boko (Hanacaraka:ꦕꦤ꧀ꦝꦶ​ꦫꦠꦸ​ꦧꦏ, bahasa Jawa: Candhi Ratu Baka) adalah situs purbakala yang merupakan kompleks sejumlah sisa bangunan yang berada kira-kira 3 km di sebelah selatan dari kompleks Candi Prambanan, 18 km sebelah timur Kota Yogyakarta atau 50 km barat daya Kota Surakarta, Jawa Tengah, Indonesia. Situs Ratu Boko terletak di sebuah bukit pada ketinggian 196 meter dari permukaan laut. Luas keseluruhan kompleks adalah sekitar 25 ha.",Budaya,Yogyakarta,4.6,"{'lat': -7.7705416, 'lng': 110.4894158}",-77.705.416,1.104.894.158,75000,https://asset.kompas.com/crops/QF9PQFggMLHGmaxQbX3D2Ikpk2Q=/0x0:720x480/750x500/data/photo/2021/11/17/61949f7a68b64.jpg
116,Pantai Depok Jogja,"Pantai Depok (bahasa Jawa: ꦥꦱꦶꦱꦶꦂ ꦝꦺꦥꦺꦴꦏ꧀, translit. Pasisir Dhépok) merupakan objek wisata pantai yang terletak di Kecamatan Kretek, Kabupaten Bantul, Daerah Istimewa Yogyakarta, sekitar tiga puluh kilometer di sebelah selatan Kota Yogyakarta. Pantai ini terkenal akan pasar ikannya yang ikannya merupakan hasil tangkapan nelayan Pantai Depok.",Bahari,Yogyakarta,4.3,"{'lat': -8.0137087, 'lng': 110.2914777}",-80.137.087,1.102.914.777,10000,https://tempatasik.com/wp-content/uploads/2017/09/pantai-depok.jpg
117,Pantai Sundak,"Pantai Sundak merupakan salah satu pantai indah yang berada di Gunung Kidul tepatnya di dekat Pantai Indrayanti. Pantai ini berpasir putih dan memilii air yang masih bersih, bening, dan menyegarkan. Tetapi ombak di Pantai Sundak ini sangat besar, jadi jika anda ingin bermain air di Pantai Sundak diharapkan untuk berhati-hati. Selain bermain air anda juga bisa berjalan-jalan di tepi pantai sambil menikmati keindahan pantai ini. Jika anda berjalan di tepi pantai sampai sejauh 40 meter anda akan menemukan batu-batu karang kecil berjajar dan batu-batu karang tersebut adalah tempat persembunyian hewan-hewan laut yang kecil, tetapi harus tetap berhati-hati karena batu karang tersebut begitu tajam.",Bahari,Yogyakarta,4.5,"{'lat': -8.147072, 'lng': 110.6079043}",-8.147.072,1.106.079.043,5000,https://4.bp.blogspot.com/-X4GBEIExq2M/WjS4s-LOBgI/AAAAAAAAF28/vJ8eBawQirUu4hY0P4PDWxNMlywHuHpYACLcBGAs/s1600/sundak.jpg
118,Hutan Mangrove Kulon Progo,Di sini ada kawasan wisata Hutan Mangrove Kulon Progo yang menyajikan keindahan alamnya. hutan Mangrove  ini memberikan pesona tersendiri selain pantai Glagah yang sudah menjadi primadona di Kulon Progo ini. Letak lokasi hutan mangrove  Kulon Progo ini sejatinya sudah masuk ke kawasan Pasir Mendit Kecamatan Temon Kulon Progo.,Bahari,Yogyakarta,4.1,"{'lat': -7.8933459, 'lng': 110.0198257}",-78.933.459,1.100.198.257,5000,https://4.bp.blogspot.com/-ghquE_6EVGQ/W3EynVNMwCI/AAAAAAAADgw/mYpYOqfw9-sdZFdx6Ld_Ec5G-63jpyPdgCLcBGAs/s1600/KURAU.jpg
119,Jogja Bay Pirates Adventure Waterpark,"Jogja Bay Waterpark atau Jogja Bay (bahasa Jawa: ꦠꦼꦭꦸꦏ꧀ꦔꦪꦺꦴꦒꦾ 'Teluk Ngayogya') adalah salah satu taman wisata air atau waterpark terbesar di Asia Tenggara yang berlokasi di Yogyakarta, Indonesia. Taman wisata air ini dibuka secara resmi pada 20 Desember 2015.",Taman Hiburan,Yogyakarta,4.4,"{'lat': -7.747846099999999, 'lng': 110.4188754}",-77.478.461,1.104.188.754,150000,https://assets-a1.kompasiana.com/items/album/2015/12/11/jogja-bay1-566acff3f37e613709b1a295.jpg
120,Pantai Sepanjang,"Siapa sangka, ternyata Yogyakarta pun punya “Kuta”-nya sendiri Ialah Pantai Sepanjang, salah satu pantai di Kabuaten Gunungkidul. Daerah yang satu ini memang memiliki koleksi pantai cantik yang tak terhitung jumlahnya. Bahkan pantai ini digadang-gadang sebagai ‘Kuta Tempo Doeloe‘. Memang, pesona seperti apa yang ditawarkan pantai ini?",Bahari,Yogyakarta,4.4,"{'lat': -8.136665599999999, 'lng': 110.5659962}",-81.366.656,1.105.659.962,10000,https://www.yogyes.com/id/yogyakarta-tourism-object/beach/sepanjang/1.jpg
121,Pantai Krakal,"Pantai krakal merupakan pantai strategis untuk singgah, selain bisa menikmati panorama laut, wisatawan juga bisa mencicipi kuliner laut. Terdapat icon berupa bangunan berbentuk ikan diatas bukit yang sering dijadikan tempat foto.",Bahari,Yogyakarta,4.5,"{'lat': -8.145019, 'lng': 110.5998857}",-8.145.019,1.105.998.857,10000,https://ajrentalmotor.com/wp-content/uploads/2019/07/Pantai-Krakal-Jogja.png
122,Pantai Glagah,Pantai Glagah Indah adalah salah satu pantai yang menjadi objek wisata di provinsi Daerah Istimewa Yogyakarta. Pantai Glagah Indah merupakan salah satu pantai di Yogyakarta dengan hamparan pasir yang berwarna hitam dan banyak mengandung pasir besi. Pantai Glagah Indah memiliki akses yang baik,Bahari,Yogyakarta,4.4,"{'lat': -7.911942699999999, 'lng': 110.0647339}",-79.119.427,1.100.647.339,5000,https://piknikwisata.com/wp-content/uploads/2020/02/wisata-pantai-glagah.jpg
123,Pantai Siung,"Pantai Siung adalah suatu objek wisata pantai yang terletak di Kec. Tepus, tepatnya berada di Dusun Duwet, Kelurahan Purwodadi, Kecamatan Tepus, Kabupaten Gunungkidul, provinsi Daerah Istimewa Yogyakarta. Lokasinya berjarak kurang lebih 75 km dari kota Yogya dan memiliki jalur panjat tebing dengan 250 jalur berstandar internasional.\nDi sepanjang perjalanan menuju lokasi pantai, Anda akan disuguhi pemandangan bukit kapur yang ditumbuhi pohon-pohon jati. Jalan yang berkelok-kelok dan menaik, merupakan tantangan yang harus Anda lewati sebelum mencapai Pantai Siung. Akan tetapi, perjalanan yang melelahkan akan terbayar ketika Anda sudah berada di kawasan Pantai Siung. Pantai dengan hamparan pasir putih dan suara deburan ombak, akan membuat suasana hati dan pikiran Anda tenang dan damai.\nKarena pantai ini sangat terpencil, fasilitas yang tersedia masih minim. Untuk akomodasi penginapan belum tersedia di sini, tetapi jika Anda ingin bermalam di Pantai Siung, Anda bisa menggunakan pondok pemanjat yang bentuknya mirip rumah panggung dengan kapasitas kurang lebih sekitar 20 orang. Jika Anda ingin bermalam dengan suasana alam, anda bisa membawa tenda sendiri yang bisa Anda gunakan di area camping ground.\nJika Anda dari Kota Yogyakarta, Anda bisa menggunakan jalur Yogyakarta-Wonosari-Tepus-Purwodadi-Pantai Siung. Jika Anda menggunakan transportasi umum, Anda dapat menggunakan bus dari Terminal Giwangan Yogyakarta dengan menggunakan bus jurusan Jogja-Wonosari. Sampai di terminal Wonosari, Anda dapat menggunakan angkutan umum jurusan Wonosari-Jepitu. Sesampai Pertigaan Balai Desa Purwodadi, Anda bisa menggunakan jasa ojek, karena hanya itu transportasi umum yang bisa digunakan sampai ke Pantai Siung.",Bahari,Yogyakarta,4.6,"{'lat': -8.1818233, 'lng': 110.6832394}",-81.818.233,1.106.832.394,10000,https://piknikwisata.com/wp-content/uploads/2020/02/info-wisata-pantai-siung-jogja.jpg
124,Pantai Sadranan,"Pantai Sadranan Jogja adalah butiran intan permata tersembunyi yang tiba-tiba memunculkan diri, dari dalam tumpukan harta karun deretan pantai pantai indah di Jogja. Seperti halnya pantai-pantai lain di kawasan Selatan Jogja, Pantai Sadranan juga memiliki ciri khas pasir putih dengan karang koral di area sangaet dekat dengan bibir pantai. Pasir putih ini mengingatkan pada Pantai terkenal semacam Kuta di Bali dan Mandalika di Lombok. Namun pantai di gunung kidul ini punya kelebihan dari 2 pantai terkenal itu, yaitu terdapatnya koral karang di pantai. Selain itu, pantai ini juga masih terbilang sepi. Kedua kelebihan ini, membuat pengunjung benar-benar bisa menikmati keasrian pantai tanpa harus terganggu hiruk pikuknya manusia.",Bahari,Yogyakarta,4.6,"{'lat': -8.145667999999997, 'lng': 110.6043914}",-8.145.668,1.106.043.914,10000,https://www.indonesiana.id/images/all/2020/09/12/f202009120621081.jpg
125,Pantai Nguluran,"Di pantai Nguluran anda hanya bisa melihat hamparan laut luas serta spot foto. Semua fasilitas itu adanya di atas tebing. Sekitar belasan meter dari permukaan air pantai. Spot favorit di resort pantai ini adalah teras kaca. Teras kaca ini dapat dijadikan spot selfie dengan latar belakang pantai. Pengunjung akan mendapatkan foto yang sangat bagus dan indah untuk dipajang di IG, FB, atau media sosial lain. Apalagi jika foto diambil saat sunset. Saat berfoto di teras kaca, pengunjung akan merasakan sensasi yang menegangkan. Sensasi tegang ini timbul akibat teras kaca yang tepat berdiri di atas pinggir laut. Sensasi yang timbul seperti berjalan di atas seutas tali pada ketingian belasan meter di atas air laut. Namun tidak perlu kuatir, pihak pengelola menjamin keselematan para pengunjung, sepanjang tidak melanggar peraturan yang sudah di buat pihak pengelola.",Bahari,Yogyakarta,4.1,"{'lat': -8.1060061, 'lng': 110.4618655}",-81.060.061,1.104.618.655,10000,https://delokal.com/storage/175/Pantai-Nguluran-sumber-ig-nariswaro.jpg
126,Pantai Samas,"Pantai Samas (bahasa Jawa: ꦥꦱꦶꦱꦶꦂ​ꦱꦩꦱ꧀, translit. Pasisir Samas) merupakan salah satu pantai yang berada di deretan pantai sebelah timur Pantai Parangtritis. Lokasi Pantai Samas kurang lebih 14 km arah selatan Kota Bantul atau sekitar 35 km dari pusat Kota Yogyakarta, tepatnya di Desa Srigading, Kecamatan Sanden, Kabupaten Bantul, Daerah Istimewa Yogyakarta.",Bahari,Yogyakarta,4,"{'lat': -8.0045535, 'lng': 110.2703756}",-80.045.535,1.102.703.756,4000,https://asset.kompas.com/crops/CONCq9ZpykYKcXO_TdoaR3TjZcs=/0x0:750x500/750x500/data/photo/2021/08/29/612b38d15c744.jpg
127,Pantai Drini,"Pantai Drini adalah salah satu objek wisata yang terletak di Desa Banjarejo, Kecamatan Tanjungsari,Gunungkidul, Yogyakarta. Letaknya di sebelah timur Pantai Baron dan berjarak sekitar 1 km ke arah timur Pantai Sepanjang. Namun jarak sebenarnya yang harus ditempuh untuk sampai ke pantai ini sejauh 60 km atau sekitar 2-3 jam dari Kota Yogyakarta. Infrastruktur menuju ke Pantai Drini cukup mulus, walaupun jalan masuk untuk sampai ke pantai ini cukup terjal dan berkelok-kelok. Pantai Drini merupakan pantai yang langsung berhadapan dengan Samudra Hindia. Pantai ini memiliki lereng pantai yang cukup curam sekitar 10 derajat dan merupakan bagian dari Wonosari yang didominasi oleh batuan karst dari Gunung Sewu. Pantai ini belum banyak terjamah oleh wisatawan lokal maupun asing, karena letaknya yang berada di daerah terpencil. Sehingga, Pantai Drini ini dikenal dengan nama Pantai Perawan. Sebutan ini digunakan oleh masyarakat setempat karena kondisi Pantai Drini yang masih bersih, udara yang sejuk, air yang terasa dingin ditambah dengan hamparan pasir putih yang mempesona dan aliran airnya yang tidak seganas Pantai Parangtritis Pantai ini memiliki sebuah tebing besar yang berada di tengah-tengah pantai dan membagi pantai ini menjadi dua sisi, yaitu sisi barat dan sisi timur . Tebing ini terlihat begitu indah sehingga membuatnya seolah-olah seperti pulau kecil yang terapung di tengah pantai. Di atas karang ini dibangun mercusuar dimana dari menaranya mata kita akan dimanjakan dengan pemandangan yang luar biasa indahnya.. Di pantai ini pengunjung juga dapat melihat dengan jelas rumput-rumput laut di antara karang-karang laut dan biota laut lainnya.",Bahari,Yogyakarta,4.5,"{'lat': -8.1384509, 'lng': 110.577522}",-81.384.509,110.577.522,10000,https://upload.wikimedia.org/wikipedia/commons/5/52/Pantai_Drini_Top_View.jpg
128,Air Terjun Sri Gethuk,"Air Terjun Sri Gethuk merupakan salah satu objek wisata alam yang terletak di Kecamatan Playen, Kabupaten Gunungkidul, Yogyakarta. Air terjun ini berada di tepi Sungai Oyo sehingga untuk menikmatinya harus menyelusuri sungai dengan rakit. Sepanjang perjalanan akan disuguhi pemandangan berupa tebing tebing kapur dikanan-kiri dan rimbunnya pepohonan. Jika di musim kemarau, air sungai akan sangat jernih berwana kehijauan dan tenang.\nAir terjun Sri Gethuk ini memiliki 3 sumber mata air yaitu mata air Ngandong, Dong Poh, dan Ngumbul. Ketiga mata air ini berkumpul dan mengalir melalui tebing tinggi hingga membentuk air terjun Sri Gethuk. Air Terjun Sri Gethuk memiliki tinggi sekira 25 meter dengan 3-5 terjunan air terjun tergantung musim. Air yang tak pernah kering itu jatuh tak membuat kolam namun langsung merayapi bebatuan kapur yang rapi di tepi sungai. Air terjun ini sedang dalam tahap pengembangan untuk menjadi destinasi wisata andalan Kabupaten Gunungkidul selain dari pantai dan pegunungan karst.\nAir Terjun Sri Gethuk juga disebut sebagai Air Terjun Slempret. Nama Slempret sendiri berasal dari legenda yang ada di Desa Bleberan. Menurut cerita yang beredar di masyarakat, air tejun ini merupakan pusatnya para jin dengan pimpinan Jin Anggo Menduro. Air terjun ini bermula dari tiga sumber mata air yaitu Kedungpoh, Ngandong, dan Ngumbul. Ketiga sumber mata air tersebut mengalir menjadi satu dan membentuk butiran-butiran air yang jatuh dari tebing bebatuan karst yang tandus.",Cagar Alam,Yogyakarta,4.4,"{'lat': -7.943178000000001, 'lng': 110.48924}",-7.943.178,11.048.924,15000,https://www.datawisata.com/wp-content/uploads/2018/12/Air-Terjun-Sri-Gethuk-Gunungkidul-1024x713.jpg
129,Candi Sewu,"Candi Sewu atau Manjusrighra (Hanacaraka:ꦕꦤ꧀ꦝꦶ​ꦱꦺꦮꦸ, Jawa: Candhi Sèwu) adalah candi Buddha yang dibangun pada abad ke-8 Masehi yang berjarak hanya delapan ratus meter di sebelah utara Candi Prambanan. Candi Sewu merupakan kompleks candi Buddha terbesar kedua setelah Candi Borobudur di Jawa Tengah. Candi Sewu berusia lebih tua daripada Candi Borobudur dan Prambanan. Meskipun aslinya memiliki 249 candi, oleh masyarakat setempat candi ini dinamakan ""Sewu"" yang berarti seribu dalam bahasa Jawa. Penamaan ini berdasarkan kisah legenda Loro Jonggrang.\nSecara administratif, kompleks Candi Sewu terletak di Dukuh Bener, Desa Bugisan, Kecamatan Prambanan, Kabupaten Klaten, Provinsi Jawa Tengah.",Budaya,Yogyakarta,4.6,"{'lat': -7.7439217, 'lng': 110.4929095}",-77.439.217,1.104.929.095,50000,https://rentalmobiljogja.id/wp-content/uploads/2017/01/candi-sewu-01-1280x720.jpg
130,Pantai Wediombo,"Pantai Wediombo (O Jawa: Wedhiamba) adalah sebuah pantai yang berada di Desa Jepitu, Girisubo, Gunungkidul di dekat Pantai Siung, berjarak 80 km dari kota Yogyakarta. Pantai tersebut meliputi sebuah teluk yang dikelilingi pegunungan batu karang dan pasir putih. Di tengah laut, batu karang tampak menonjol. Tempat tersebut juga dipakai untuk selancar. Ketinggian ombak dapat mencapai 3-4 meter. Pantai Wediombo menghadap ke barat dan matahari berada di sisi selatan (pada November-Mei). Dari pantai ini, orang-orang dapat melihat matahari terbenam pada waktu sore. Selin untuk berselancar, Wediombo juga memiliki kolam alami sampai perairan tanpa ombak. Ada pula tempat untuk snorkeling. Wediombo masuk salah satu dari 13 tempat yang masuk Cagar Alam Dunia UNESCO Gunung Sewu.",Bahari,Yogyakarta,4.5,"{'lat': -8.1862462, 'lng': 110.709901}",-81.862.462,110.709.901,5000,https://raskita.com/wp-content/uploads/2019/09/Pantai-Wediombo.jpg
131,Pantai Jogan,"Pantai Jogan adalah objek wisata pantai yang terletak di Dusun Duwet, Purwodadi, Tepus, Kabupaten Gunungkidul, Daerah Istimewa Yogyakarta. Lokasinya berjarak kurang lebih 74 km dari Pusat kota Yogyakarta. Pantai ini terletak di jajaran pegunungan Gunungkidul, yang memberikan pemandangan alam tebing dan air terjun yang mengarah ke laut lepas.",Bahari,Yogyakarta,4.4,"{'lat': -8.180135, 'lng': 110.6763715}",-8.180.135,1.106.763.715,5000,https://www.datawisata.com/wp-content/uploads/2020/03/udarider_id-1024x768.jpg
132,Pantai Ngrenehan,Pantai Ngrenehan merupakan\npantai nelayan. Terletak di desa Kanigoro\nKecamatan Saptosari kurang lebih 30 km di sebelah selatan kota Wonosari. Suatu pantai berupa teluk yang dikelilingi hamparan perbukitan kapur dan memiliki panorama yang sangat memukau dengan deburan ombak menerpa pasir putih. Para wisatawan dapat menyaksikan aktivitas kegiatan nelayan dan menikmati ikan siap saji atau membawa ikan segar sebagai oleh-oleh.,Bahari,Yogyakarta,4.4,"{'lat': -8.1211475, 'lng': 110.5142337}",-81.211.475,1.105.142.337,3000,https://mytrip123.com/wp-content/uploads/2019/05/ff-1.jpg
133,Pantai Jungwok,"Pantai Jungwok adalah pantai yang terletak di Desa Jepitu, Kecamatan Girisubo, Kabupaten Gunungkidul, Daerah Istimewa Yogyakarta. Pantai Jungwok merupakan salah satu pantai yang memiliki panorama yang indah dengan pasir putih yang khas dari pantai di Gunung Kidul. Pantai Jungwok terletak di sebelah Timur Pantai Wediombo dan di sebelah Barat Pantai Ngusalan. Jarak Pantai Jungwok dari Kota Wonosari sekitar 40 km. Akses jalan menuju Pantai Jungwook masih cukup sulit, itu dikarenakan jalan yang masih belum diaspal. Pantai Jungwok sering menjadi destinasi wisata karena tempatnya yang nyaman untuk berkemah.",Bahari,Yogyakarta,4.6,"{'lat': -8.197822, 'lng': 110.7123397}",-8.197.822,1.107.123.397,5000,https://cdn.nativeindonesia.com/foto/pantai-jungwok/Landscape-Pantai-Jungwok.jpg
134,Pantai Greweng,"Di Kabupaten Gunungkidul, tidak sulit memilih pantai yang masih sepi dan indah. Pantai Greweng yang berada di Kecamatan Girisubo adalah satu di antaranya. Tidak hanya cantik, pantai ini juga dikenal sebagai destinasi untuk berkemah. Namun, siapkan energi lebih untuk mencapai lokasinya yang terpencil.",Bahari,Yogyakarta,4.6,"{'lat': -8.197864399999998, 'lng': 110.7186216}",-81.978.644,1.107.186.216,5000,https://nginapdijogja.com/wp-content/uploads/2020/10/Pantai-Greweng.jpg
135,Pantai Sedahan,"Pantai Sedahan ini memiliki garis pantai yang cukup panjang dan cukup luas untuk dijadikan sebagai arena bermain. Pada kedua sisi pantai, terdapat tebing karang yang mengapit pantai ini dan menjorok ke tengah laut. Pantai Sedahan mempunyai deburan ombak yang khas laut selatan dan hamparan pasir putih dengan butiran butiran yang halus. Air Biru kehijauan yang bening, segar, dan berkilauan teritampa cahaya matahari akan menghipnotis siapa pun untuk bermain air dan menceburkan diri di pantai tersebut. Tetapi pengunjung harus tetap berhati hati karena pantai selatan selalu berarus dan berombak kuat, maka para pengunjung tidak disarankan untuk berenang terlalu jauh dari daratan. Pantai Sedahan ini juga dikenal oleh banyak orang sebagai lokasi memancing yang menyenangkan. Banyak pengunjung yang rela dan menyempatkan datang jauh jauh hanya untuk memancing ikan di Pantai Sedahan ini.",Bahari,Yogyakarta,4.5,"{'lat': -8.1978943, 'lng': 110.7208535}",-81.978.943,1.107.208.535,5000,https://www.alodiatour.com/wp-content/uploads/2018/12/Rute-menuju-Pantai-Sedahan.jpg
136,Pantai Watu Kodok,"Pantai Watu Kodok merupakan salah satu pantai yang ada di Gunung Kidul. Pantai Watu Kodok ini memiliki pasir putih dan air laut yang masih berwarna biru yang sangat indah. Di pantai ini terdapat beberapa batu karang yang terjal, batu tersebut menjadi daya tarik para wisatawan dan keunikan bagi pantai itu sendiri. Dan suasana pantai yang masih alami juga menjadikan pantai ini menjadi daya tariknya, tetapi pantai ini masih tergolong pantai baru jadi masih belum banyak wisatawan. Pantai Watu Kodok ini sangat cocok bagi Anda yang ingin menghabiskan waktu liburan bersama keluarga.",Bahari,Yogyakarta,4.6,"{'lat': -8.1370556, 'lng': 110.5746611}",-81.370.556,1.105.746.611,5000,https://jogjatourwisata.id/wp-content/uploads/2019/04/spot-cantik-pantai-watu-kodok.jpg
137,Pantai Kesirat,"Pada umumnya pantai identik dengan pasirnya bukan, namun pantai kesirat memiliki keunikan tersendiri yang akan anda temukan disini. Pantai kesirat tidak memiliki pasir namun anda akan menemukan tebing tebing yang memeiliki struktur yang cantik kemudian anda kana menikmati pantai di atasnya, tempat ini juga sangat cocok untuk menikmati sunset. Keindahan pantai ini membuat semua orang tidak bisa melupakannya seperti janji mantan hehee.. pantai kesirat memiliki spot spot foto yang instagramable banget cocok sekali untuk kamu yang suka berfoto. Keunikan lain yang menjadi ciri khas dari wisata Pantai Kesirat adalah hadirnya sebuah pohon yang tampak berdiri kokoh yang menjadi ikon dari tempat wisata ini. Banyak wisatawan yang memanfaatkan pohon ini sebagai latar belakang foto mereka.",Bahari,Yogyakarta,4.6,"{'lat': -8.096153500000002, 'lng': 110.4350483}",-80.961.535,1.104.350.483,5000,https://piknikwisata.com/wp-content/uploads/2020/05/info-pantai-kesirat.jpg
138,Pantai Ngandong,"Pantai Ngandong terletak di Desa Sidoarjo, Kecamatan Tepus, Kabupaten Gunung Kidul, Yogyakarta. Pantai ini sebenarnya tidak jauh dari Pantai Indrayanti yang lebih terkenal dahulu, tepatnya terletak di sebelah barat laut dari pantai Indrayanti. Pantai Ngandong termasuk pantai yang kecil namun mempunyai ciri khas tersendiri yang menjadi daya tarik bagi wisatawan. Meskipun demikian belum banyak wisatawan yang mengetahui destinasi wisata pantai ini. Pantai ini ramai penunjung ketika musim liburan, namun sepi ketika hari-hari biasa.",Bahari,Yogyakarta,4.5,"{'lat': -8.146423, 'lng': 110.6061408}",-8.146.423,1.106.061.408,10000,https://ksmtour.com/media/images/articles26/pantai-ngandong-gunungkidul-yogyakarta.jpg
139,Galaxy Waterpark Jogja,"Galaxy Waterpark adalah taman rekreasi air yang berdiri di atas lahan seluas 2,5 hektar ini sangat cukup untuk menampung pengunjung di waktu liburan. Dengan lokasi yang sangat luas banyak wahana dan fasilitas yang bisa kamu nikmati. Di tempat ini juga tersedia beberapa kolam, dari kolam anak sampai kolam dewasa. Selain itu fasilitas yang disediakan pengelolapun juga terbilang lengkap untuk mendukung kenyamananmu saat berlibur.",Taman Hiburan,Yogyakarta,4.3,"{'lat': -7.815963299999999, 'lng': 110.4136917}",-78.159.633,1.104.136.917,40000,https://www.hargatiket.net/wp-content/uploads/2018/09/Wahana-Galaxy-Waterpark-Yogyakarta.jpg
